[
  {
    "transactionId": "TXN-1001",
    "patronName": "kiran",
    "bookId": 1001,
    "borrowDate": "2026-06-15",
    "dueDate": "2026-06-29",
    "status": "Borrowed",
    "fine": 0.0
  },
  {
    "transactionId": "TXN-1002",
    "patronName": "sohil",
    "bookId": 1003,
    "borrowDate": "2026-06-18",
    "dueDate": "2026-07-02",
    "status": "Borrowed",
    "fine": 0.0
  }
]
